{
  "$schema": "https://json-schema.org/draft/2020-12/schema",
  "$id": "https://asterion.local/schemas/session-context/v1/command.schema.json",
  "title": "Asterion Session Context Command v1",
  "type": "object",
  "additionalProperties": false,
  "required": [
    "protocol",
    "command_id",
    "session_id",
    "generation",
    "authority_revision",
    "idempotency_key",
    "operation",
    "payload"
  ],
  "properties": {
    "protocol": {"const": "asterion.session-context/v1"},
    "command_id": {"$ref": "#/$defs/opaque_id"},
    "session_id": {"$ref": "#/$defs/opaque_id"},
    "generation": {"type": "integer", "minimum": 1, "maximum": 9007199254740991},
    "authority_revision": {"type": "integer", "minimum": 1, "maximum": 9007199254740991},
    "idempotency_key": {"$ref": "#/$defs/opaque_id"},
    "operation": {
      "enum": [
        "session.attachment.bind",
        "session.branch.summarize",
        "session.clone",
        "session.compact",
        "session.continuation.delete",
        "session.continuation.resume",
        "session.describe",
        "session.fork",
        "session.label.set",
        "session.name.set",
        "session.tree.navigate",
        "session.tree.read"
      ]
    },
    "payload": {}
  },
  "allOf": [
    {
      "oneOf": [
        {
          "properties": {
            "operation": {"const": "session.attachment.bind"},
            "payload": {"$ref": "#/$defs/attachment_bind"}
          }
        },
        {
          "properties": {
            "operation": {"const": "session.branch.summarize"},
            "payload": {"$ref": "#/$defs/branch_summarize"}
          }
        },
        {
          "properties": {
            "operation": {"const": "session.clone"},
            "payload": {"$ref": "#/$defs/continuation"}
          }
        },
        {
          "properties": {
            "operation": {"const": "session.compact"},
            "payload": {"$ref": "#/$defs/compact"}
          }
        },
        {
          "properties": {
            "operation": {"const": "session.continuation.delete"},
            "payload": {"$ref": "#/$defs/continuation"}
          }
        },
        {
          "properties": {
            "operation": {"const": "session.continuation.resume"},
            "payload": {"$ref": "#/$defs/continuation"}
          }
        },
        {
          "properties": {
            "operation": {"const": "session.describe"},
            "payload": {"$ref": "#/$defs/empty"}
          }
        },
        {
          "properties": {
            "operation": {"const": "session.fork"},
            "payload": {"$ref": "#/$defs/fork"}
          }
        },
        {
          "properties": {
            "operation": {"const": "session.label.set"},
            "payload": {"$ref": "#/$defs/label_set"}
          }
        },
        {
          "properties": {
            "operation": {"const": "session.name.set"},
            "payload": {"$ref": "#/$defs/name_set"}
          }
        },
        {
          "properties": {
            "operation": {"const": "session.tree.navigate"},
            "payload": {"$ref": "#/$defs/continuation_entry"}
          }
        },
        {
          "properties": {
            "operation": {"const": "session.tree.read"},
            "payload": {"$ref": "#/$defs/continuation"}
          }
        }
      ]
    }
  ],
  "$defs": {
    "opaque_id": {
      "type": "string",
      "pattern": "^[A-Za-z0-9][A-Za-z0-9._:-]{0,127}$"
    },
    "sha256": {
      "type": "string",
      "pattern": "^[0-9a-f]{64}$"
    },
    "media_type": {
      "type": "string",
      "pattern": "^[a-z0-9][a-z0-9!#$&^_.+-]*/[a-z0-9][a-z0-9!#$&^_.+-]*$"
    },
    "nullable_opaque_id": {
      "oneOf": [
        {"$ref": "#/$defs/opaque_id"},
        {"type": "null"}
      ]
    },
    "empty": {
      "type": "object",
      "additionalProperties": false,
      "properties": {}
    },
    "continuation": {
      "type": "object",
      "additionalProperties": false,
      "required": ["continuation_id"],
      "properties": {
        "continuation_id": {"$ref": "#/$defs/opaque_id"}
      }
    },
    "continuation_entry": {
      "type": "object",
      "additionalProperties": false,
      "required": ["continuation_id", "entry_id"],
      "properties": {
        "continuation_id": {"$ref": "#/$defs/opaque_id"},
        "entry_id": {"$ref": "#/$defs/opaque_id"}
      }
    },
    "budget": {
      "type": "object",
      "additionalProperties": false,
      "required": [
        "controller_tokens",
        "application_tokens",
        "child_tokens",
        "aggregate_tokens",
        "cost_micros",
        "deadline_ms"
      ],
      "properties": {
        "controller_tokens": {"type": "integer", "minimum": 0, "maximum": 9007199254740991},
        "application_tokens": {"type": "integer", "minimum": 0, "maximum": 9007199254740991},
        "child_tokens": {"type": "integer", "minimum": 0, "maximum": 9007199254740991},
        "aggregate_tokens": {"type": "integer", "minimum": 0, "maximum": 9007199254740991},
        "cost_micros": {"type": "integer", "minimum": 0, "maximum": 9007199254740991},
        "deadline_ms": {"type": "integer", "minimum": 1, "maximum": 9007199254740991}
      }
    },
    "attachment_bind": {
      "type": "object",
      "additionalProperties": false,
      "required": [
        "input_id",
        "attachment_id",
        "body_ref",
        "media_type",
        "sha256",
        "size"
      ],
      "properties": {
        "input_id": {"$ref": "#/$defs/opaque_id"},
        "attachment_id": {"$ref": "#/$defs/opaque_id"},
        "body_ref": {"$ref": "#/$defs/opaque_id"},
        "media_type": {"$ref": "#/$defs/media_type"},
        "sha256": {"$ref": "#/$defs/sha256"},
        "size": {"type": "integer", "minimum": 0, "maximum": 9007199254740991}
      }
    },
    "branch_summarize": {
      "type": "object",
      "additionalProperties": false,
      "required": ["continuation_id", "entry_id", "instructions_ref", "budget"],
      "properties": {
        "continuation_id": {"$ref": "#/$defs/opaque_id"},
        "entry_id": {"$ref": "#/$defs/opaque_id"},
        "instructions_ref": {"$ref": "#/$defs/nullable_opaque_id"},
        "budget": {"$ref": "#/$defs/budget"}
      }
    },
    "compact": {
      "type": "object",
      "additionalProperties": false,
      "required": ["continuation_id", "instructions_ref", "budget"],
      "properties": {
        "continuation_id": {"$ref": "#/$defs/opaque_id"},
        "instructions_ref": {"$ref": "#/$defs/nullable_opaque_id"},
        "budget": {"$ref": "#/$defs/budget"}
      }
    },
    "fork": {
      "type": "object",
      "additionalProperties": false,
      "required": ["continuation_id", "entry_id", "position"],
      "properties": {
        "continuation_id": {"$ref": "#/$defs/opaque_id"},
        "entry_id": {"$ref": "#/$defs/opaque_id"},
        "position": {"enum": ["at", "before"]}
      }
    },
    "label_set": {
      "type": "object",
      "additionalProperties": false,
      "required": ["continuation_id", "entry_id", "label_ref"],
      "properties": {
        "continuation_id": {"$ref": "#/$defs/opaque_id"},
        "entry_id": {"$ref": "#/$defs/opaque_id"},
        "label_ref": {"$ref": "#/$defs/nullable_opaque_id"}
      }
    },
    "name_set": {
      "type": "object",
      "additionalProperties": false,
      "required": ["name_ref"],
      "properties": {
        "name_ref": {"$ref": "#/$defs/opaque_id"}
      }
    }
  }
}
